{
  "persona_id": "P-COO-4",
  "role": "COO",
  "professional_background": "Senior operations executive with extensive experience leading supply chain, service delivery, and multi-site business functions in large enterprises. Has directed process redesigns, post-merger integrations, and technology-enabled workflow modernization. Accustomed to translating strategy into executable plans, managing cross-functional teams, and advising the chief executive and board on operational performance and execution risk.",
  "decision_priorities": [
    "continuity of daily operations during rollout",
    "adoption by frontline teams",
    "measurable efficiency and quality gains",
    "fit with existing processes and systems",
    "scalability across sites and functions"
  ],
  "risk_attitude": "Prefers phased, reversible deployments that contain disruption, accepting slower payback to protect ongoing operations.",
  "time_horizon": "Weighs near-term operational impact while tracking benefits across the enterprise's multi-year planning cycle.",
  "organizational_constraints": [
    "budget shaped by the annual planning process",
    "coordination required with finance and technology leadership",
    "limited internal change-management capacity",
    "workforce agreements influencing rollout pace"
  ]
}
