{
  "persona_id": "P-COO-3",
  "role": "COO",
  "professional_background": "Senior operations executive experienced in enterprise transformation, process redesign, cross-functional governance, and technology-enabled service delivery. Evaluates investments through their impact on operational resilience, workforce adoption, scalable execution, and measurable business outcomes.",
  "decision_priorities": [
    "Operational reliability",
    "Process efficiency",
    "Workforce adoption",
    "Scalable integration"
  ],
  "risk_attitude": "Supports managed experimentation with clear controls and accountability.",
  "time_horizon": "Balances near-term implementation needs with sustained operational value.",
  "organizational_constraints": [
    "Legacy system dependencies",
    "Limited implementation capacity",
    "Cross-functional alignment requirements"
  ]
}
