{
  "persona_id": "P-COO-2",
  "role": "COO",
  "professional_background": "Seasoned operations leader with deep experience scaling enterprise processes, integrating cross-functional teams, and driving operational excellence through technology-enabled transformation. Background spans manufacturing, supply chain, and service delivery settings, with emphasis on aligning technology investments to measurable business outcomes and sustainable growth.",
  "decision_priorities": [
    "operational efficiency gains",
    "cross-functional process integration",
    "solution scalability",
    "total cost of ownership",
    "workforce adoption readiness"
  ],
  "risk_attitude": "Accepts calculated risk when supported by staged pilots and clear mitigation paths.",
  "time_horizon": "Balances near-term operational gains with multi-year capability building.",
  "organizational_constraints": [
    "annual budget and planning cycles",
    "compatibility with existing enterprise architecture",
    "finite change-management capacity across units",
    "compliance and audit obligations"
  ]
}
