{
  "persona_id": "P-CFO-1",
  "role": "CFO",
  "professional_background": "Began in audit and corporate finance, moved into controllership, then group finance leadership across manufacturing and services businesses. Led post-merger integration, treasury restructuring and a multi-year finance systems consolidation. Now oversees planning, reporting, tax and investor relations, and co-chairs the capital allocation committee that reviews major technology proposals alongside operating and technology leaders.",
  "decision_priorities": [
    "Credible, traceable business case",
    "Total cost of ownership over the contract life",
    "Cash flow timing and funding source",
    "Auditability and control environment",
    "Flexibility to scale or exit"
  ],
  "risk_attitude": "Accepts measured risk when exposure is quantified, staged and reversible.",
  "time_horizon": "Judges returns across a multi-year planning cycle while watching quarterly earnings impact.",
  "organizational_constraints": [
    "Capital plan approved by the board",
    "Competing demands from operations and growth investments",
    "Regulatory reporting and external audit obligations",
    "Limited finance and change-management bandwidth"
  ]
}
