{
  "persona_id": "P-CFO-3",
  "role": "CFO",
  "professional_background": "Senior finance executive with experience in capital planning, operational budgeting, governance, and enterprise transformation. Evaluates technology investments through financial sustainability, strategic fit, implementation readiness, and measurable business outcomes, while collaborating with technology, operations, security, and business leaders.",
  "decision_priorities": [
    "Sustainable business value",
    "Total cost visibility",
    "Cash flow resilience",
    "Operational scalability",
    "Outcome measurability"
  ],
  "risk_attitude": "Supports managed risk when assumptions, controls, and accountability are clear.",
  "time_horizon": "Balances near-term financial discipline with durable enterprise value.",
  "organizational_constraints": [
    "Competing capital demands",
    "Budget planning cycles",
    "Governance and audit requirements",
    "Limited implementation capacity"
  ]
}
